{
  "schemaVersion": "1.0.0",
  "id": "00000000-0000-4000-8000-000000000012",
  "revision": 1,
  "relationId": "00000000-0000-4000-8000-000000000005",
  "sourcePlacementId": "00000000-0000-4000-8000-000000000008",
  "targetPlacementId": "00000000-0000-4000-8000-000000000010",
  "waypoints": [],
  "style": {},
  "extensions": {}
}
